{
  "$schema": "https://json-schema.org/draft/2020-12/schema",
  "$id": "https://openai.local/ai-ip/supplier-statement.schema.json",
  "type": "object",
  "additionalProperties": false,
  "required": ["schemaVersion", "pairId", "condition", "providerLabel", "actualModelRevision", "currency", "actualFen", "issuedAt", "statementReferenceCommitment"],
  "properties": {
    "schemaVersion": {"const": 1},
    "pairId": {"$ref": "#/$defs/sha256"},
    "condition": {"enum": ["generic", "candidate"]},
    "providerLabel": {"$ref": "#/$defs/label"},
    "actualModelRevision": {"$ref": "#/$defs/label"},
    "currency": {"const": "CNY"},
    "actualFen": {"$ref": "#/$defs/fen"},
    "issuedAt": {"$ref": "#/$defs/timestamp"},
    "statementReferenceCommitment": {"$ref": "#/$defs/sha256"}
  },
  "$defs": {
    "label": {"type": "string", "pattern": "^[A-Za-z0-9][A-Za-z0-9._:+/@() -]{0,199}$"},
    "timestamp": {"type": "string", "pattern": "^\\d{4}-\\d{2}-\\d{2}T\\d{2}:\\d{2}:\\d{2}\\.\\d{3}Z$"},
    "sha256": {"type": "string", "pattern": "^[0-9a-f]{64}$"},
    "fen": {"type": "integer", "minimum": 0, "maximum": 18446744073709551615}
  }
}
