{
  "schemaVersion": 1,
  "pairId": "cccccccccccccccccccccccccccccccccccccccccccccccccccccccccccccccc",
  "condition": "candidate",
  "providerLabel": "approved-provider",
  "actualModelRevision": "approved-model-revision",
  "currency": "CNY",
  "actualFen": 12,
  "issuedAt": "2026-08-30T10:01:00.000Z",
  "statementReferenceCommitment": "dddddddddddddddddddddddddddddddddddddddddddddddddddddddddddddddd"
}
