{"actualFen":12,"actualModelRevision":"approved-model-revision","condition":"generic","currency":"CNY","issuedAt":"2026-08-30T10:01:00.000Z","pairId":"cccccccccccccccccccccccccccccccccccccccccccccccccccccccccccccccc","providerLabel":"approved-provider","schemaVersion":1,"statementReferenceCommitment":"dddddddddddddddddddddddddddddddddddddddddddddddddddddddddddddddd"}
